{
  "schema_version": "1.0.0",
  "id": "AUTH-001",
  "title": "Refresh token rotation",
  "summary": "Refresh token rotation",
  "type": "Story",
  "body": "# AUTH-001 — Refresh token rotation\n\nRotate refresh tokens on use.\n",
  "acceptance_criteria": [
    "Successful refresh returns a new refresh token and invalidates the previous one",
    "Reuse of a rotated refresh token is rejected"
  ],
  "labels": ["auth"],
  "app": "Example.Api",
  "app_hint": "Example.Api",
  "source": "local_file",
  "source_path": "fixtures/tickets/AUTH-001.md",
  "sealed_at": "2026-09-13T12:00:00Z"
}
